product_name,brand,root_category,leaf_category,discounted_price,similarity_score
Absurd Full Sleeve Solid Men's Reversible Sweatshirt,unknown,clothing,sweatshirts,1650.0,0.3889092163692786
Fila Full Sleeve Solid Men's Reversible Sweatshirt,unknown,clothing,sweatshirts,1279.0,0.3861681961112325
Ashdan Sleeveless Solid Men's Sweatshirt,Ashdan,clothing,sleeveless solid men sweatshirt,719.0,0.3816322270929157
Cayman Full Sleeve Solid Men's Sweatshirt,unknown,clothing,sweatshirts,1075.0,0.37455170426279
Mudo Full Sleeve Solid Men's Sweatshirt,unknown,clothing,sweatshirts,1299.0,0.36364383286332225
