uniq_id,crawl_timestamp,product_url,product_name,product_category_tree,pid,retail_price,discounted_price,image,is_FK_Advantage_product,description,product_rating,overall_rating,brand,product_specifications,category_path,root_category,leaf_category,spec_text,clean_name,clean_brand,clean_description,clean_category,combined_text
b26f6dba224447d488270d0bce4c1cab,2015-12-30 00:17:46 +0000,http://www.flipkart.com/gemz-tote/p/itmede5gfjgfzhdb?pid=HMBEDE5G8RJN47V5,Gemz Tote,"[""Bags, Wallets & Belts >> Bags >> Totes >> Gemz Totes""]",HMBEDE5G8RJN47V5,1725.0,995.0,"[""http://img5a.flixcart.com/image/hand-messenger-bag/7/v/5/s248-gemz-tote-ll1033-original-imaedf7uurjz2vhz.jpeg"", ""http://img6a.flixcart.com/image/hand-messenger-bag/7/v/5/s248-gemz-tote-ll1033-original-imaedf7uurjz2vhz.jpeg"", ""http://img5a.flixcart.com/image/hand-messenger-bag/7/v/5/s248-gemz-tote-ll1033-original-imaedf7uhb4nqpjg.jpeg"", ""http://img6a.flixcart.com/image/hand-messenger-bag/7/v/5/s248-gemz-tote-ll1033-original-imaedf7um53eapxz.jpeg"", ""http://img5a.flixcart.com/image/hand-messenger-bag/7/v/5/s248-gemz-tote-ll1033-original-imaedf7ujz5ub3ga.jpeg"", ""http://img6a.flixcart.com/image/hand-messenger-bag/7/v/5/s248-gemz-tote-ll1033-original-imaedf7unyyghnfu.jpeg""]",False,Flipkart.com: Buy Gemz Tote for Rs. 995 from Flipkart.com. Only Genuine Products. 30 Day Replacement Guarantee. Free Shipping. Cash On Delivery!,No rating available,No rating available,unknown,"{""product_specification""=>[{""key""=>""Closure"", ""value""=>""Zip""}, {""key""=>""Type"", ""value""=>""Tote""}, {""key""=>""Material"", ""value""=>""PU""}, {""key""=>""Style Code"", ""value""=>""S248""}, {""key""=>""Ideal For"", ""value""=>""Women""}, {""key""=>""Capacity"", ""value""=>""10 L""}, {""key""=>""Occasion"", ""value""=>""Formal""}, {""key""=>""Color Code"", ""value""=>""Yellow-11""}, {""key""=>""Height"", ""value""=>""230 mm""}, {""key""=>""Width"", ""value""=>""350 mm""}, {""key""=>""Depth"", ""value""=>""120 mm""}, {""value""=>""Hand Bag""}, {""key""=>""Number of Compartments"", ""value""=>""2""}]}","bags, wallets & belts | bags | totes | gemz totes","bags, wallets & belts",gemz totes,key closure value zip key type value tote key material value pu key style code value s248 key ideal value women key capacity value 10 key occasion value formal key color code value yellow 11 key height value 230 mm key width value 350 mm key depth value 120 mm value hand bag key number compartments value,gemz tote,unknown,flipkart com buy gemz tote rs 995 flipkart com genuine products 30 day replacement guarantee free shipping cash delivery,bags wallets belts bags totes gemz totes,gemz tote unknown bags wallets belts bags totes gemz totes flipkart com buy gemz tote rs 995 flipkart com genuine products 30 day replacement guarantee free shipping cash delivery key closure value zip key type value tote key material value pu key style code value s248 key ideal value women key capacity value 10 key occasion value formal key color code value yellow 11 key height value 230 mm key width value 350 mm key depth value 120 mm value hand bag key number compartments value
2a2be061f5d76a5ea2d7ae638d92d87b,2015-12-01 06:13:00 +0000,http://www.flipkart.com/fashion-jewellery-alloy-necklace/p/itme9yfbnhn9xzzp?pid=NKCE9YFBFPA6YFSJ,Fashion Jewellery Alloy Necklace,"[""Jewellery >> Necklaces & Chains >> Necklaces""]",NKCE9YFBFPA6YFSJ,699.0,239.0,"[""http://img6a.flixcart.com/image/necklace-chain/f/s/j/nfj-59-fashion-jewellery-necklace-1100x1100-imae9xnp89sa9kwg.jpeg"", ""http://img5a.flixcart.com/image/necklace-chain/f/s/j/nfj-59-fashion-jewellery-necklace-original-imae9xnp89sa9kwg.jpeg"", ""http://img6a.flixcart.com/image/necklace-chain/f/s/j/nfj-59-fashion-jewellery-necklace-original-imae9xnpajvrzpea.jpeg"", ""http://img5a.flixcart.com/image/necklace-chain/f/s/j/nfj-59-fashion-jewellery-necklace-original-imae9xnpx34fphwt.jpeg""]",False,Fashion Jewellery Alloy Necklace - Buy Fashion Jewellery Alloy Necklace only for Rs. 239 from Flipkart.com. Only Genuine Products. 30 Day Replacement Guarantee. Free Shipping. Cash On Delivery!,No rating available,No rating available,Fashion Jewellery,"{""product_specification""=>[{""key""=>""Brand"", ""value""=>""Fashion Jewellery""}, {""key""=>""Collection"", ""value""=>""Cocktail""}, {""key""=>""Model Number"", ""value""=>""NFJ@59""}, {""key""=>""Precious/Artificial Jewellery"", ""value""=>""Fashion Jewellery""}, {""key""=>""Type"", ""value""=>""Necklace""}, {""key""=>""Ideal For"", ""value""=>""Girls, Women""}, {""key""=>""Occasion"", ""value""=>""Workwear""}, {""key""=>""Color"", ""value""=>""Beige""}, {""key""=>""Base Material"", ""value""=>""Alloy""}, {""key""=>""Setting"", ""value""=>""Softy Beign Necklace""}, {""key""=>""Pack of"", ""value""=>""1""}]}",jewellery | necklaces & chains | necklaces,jewellery,necklaces,key brand value fashion jewellery key collection value cocktail key model number value nfj 59 key precious artificial jewellery value fashion jewellery key type value necklace key ideal value girls women key occasion value workwear key color value beige key base material value alloy key setting value softy beign necklace key pack value,fashion jewellery alloy necklace,fashion jewellery,fashion jewellery alloy necklace buy fashion jewellery alloy necklace rs 239 flipkart com genuine products 30 day replacement guarantee free shipping cash delivery,jewellery necklaces chains necklaces,fashion jewellery alloy necklace fashion jewellery jewellery necklaces chains necklaces fashion jewellery alloy necklace buy fashion jewellery alloy necklace rs 239 flipkart com genuine products 30 day replacement guarantee free shipping cash delivery key brand value fashion jewellery key collection value cocktail key model number value nfj 59 key precious artificial jewellery value fashion jewellery key type value necklace key ideal value girls women key occasion value workwear key color value beige key base material value alloy key setting value softy beign necklace key pack value
95cc05f398e15115abdf4914e7cc713e,2016-01-07 05:50:25 +0000,http://www.flipkart.com/hautewagon-casual-self-design-women-s-kurti/p/itme8bq3d5tkfzvb?pid=KRTE8BQ3PS5DHXTC,Hautewagon Casual Self Design Women's Kurti,"[""Clothing >> Women's Clothing >> Ethnic Wear >> Kurtas & Kurtis >> Kurtis >> Hautewagon Kurtis""]",KRTE8BQ3PS5DHXTC,1199.0,549.0,"[""http://img5a.flixcart.com/image/kurti/c/r/q/1-1-hwkk10153-hautewagon-42-original-imae8akzcgrqtnaz.jpeg"", ""http://img6a.flixcart.com/image/kurti/c/r/q/1-1-hwkk10153-hautewagon-42-original-imae8akzbcwszy4z.jpeg"", ""http://img5a.flixcart.com/image/kurti/c/r/q/1-1-hwkk10153-hautewagon-42-original-imae8akzb6cg8ydn.jpeg"", ""http://img5a.flixcart.com/image/kurti/c/r/q/1-1-hwkk10153-hautewagon-44-original-imae8akzu6gckt4s.jpeg"", ""http://img5a.flixcart.com/image/kurti/c/r/q/1-1-hwkk10153-hautewagon-42-original-imae8akzeyucvzjm.jpeg""]",False,Hautewagon Casual Self Design Women's Kurti - Buy Green Hautewagon Casual Self Design Women's Kurti For Only Rs. 1199 Online in India. Shop Online For Apparels. Huge Collection of Branded Clothes Only at Flipkart.com,No rating available,No rating available,unknown,"{""product_specification""=>[{""value""=>""1 Kurti""}, {""key""=>""Sleeve"", ""value""=>""3/4 Sleeve""}, {""key""=>""Number of Contents in Sales Package"", ""value""=>""Pack of 1""}, {""key""=>""Fabric"", ""value""=>""Cotton""}, {""key""=>""Collar"", ""value""=>""Collar Neck""}, {""key""=>""Style"", ""value""=>""Slit on Sides""}, {""key""=>""Side Slits"", ""value""=>""Yes""}, {""key""=>""Neck"", ""value""=>""Collar Neck""}, {""key""=>""Design"", ""value""=>""Printed""}, {""key""=>""Length"", ""value""=>""42 inch""}, {""key""=>""Pattern"", ""value""=>""Self Design""}, {""key""=>""Ideal For"", ""value""=>""Women's""}, {""key""=>""Occasion"", ""value""=>""Casual""}, {""value""=>""Wash with Similar Colors, Use Detergent for colors""}]}",clothing | women's clothing | ethnic wear | kurtas & kurtis | kurtis | hautewagon kurtis,clothing,hautewagon kurtis,value kurti key sleeve value sleeve key number contents sales package value pack key fabric value cotton key collar value collar neck key style value slit sides key slits value yes key neck value collar neck key design value printed key length value 42 inch key pattern value self design key ideal value women key occasion value casual value wash similar colors use detergent colors,hautewagon casual self design women kurti,unknown,hautewagon casual self design women kurti buy green hautewagon casual self design women kurti rs 1199 online india shop online apparels huge collection branded clothes flipkart com,clothing women clothing ethnic wear kurtas kurtis kurtis hautewagon kurtis,hautewagon casual self design women kurti unknown clothing women clothing ethnic wear kurtas kurtis kurtis hautewagon kurtis hautewagon casual self design women kurti buy green hautewagon casual self design women kurti rs 1199 online india shop online apparels huge collection branded clothes flipkart com value kurti key sleeve value sleeve key number contents sales package value pack key fabric value cotton key collar value collar neck key style value slit sides key slits value yes key neck value collar neck key design value printed key length value 42 inch key pattern value self design key ideal value women key occasion value casual value wash similar colors use detergent colors
26438a51145c40d7bc9bffe23f06b358,2016-06-15 04:53:12 +0000,http://www.flipkart.com/itiha-home-liquid-air-freshener/p/itmegyyzwrf3f6ah?pid=AIREGYYZRAPHRFGD,Itiha Home Liquid Air Freshener,"[""Home Decor & Festive Needs >> Candles & Fragrances >> Home Fragrances >> Potpourri >> Itiha Potpourri >> Itiha Home Liquid Air Freshener (20 ml)""]",AIREGYYZRAPHRFGD,749.0,399.0,"[""http://img5a.flixcart.com/image/air-freshener/f/g/d/01-liquid-itiha-20-set-of-2-potpourri-oil-combo-original-imaegydhmrqghhag.jpeg"", ""http://img6a.flixcart.com/image/air-freshener/f/g/d/01-liquid-itiha-20-set-of-2-potpourri-oil-combo-original-imaegydhmrqghhag.jpeg"", ""http://img6a.flixcart.com/image/air-freshener/z/r/e/bdec-liquid-itiha-400-buddha-electrical-oil-burner-and-potpourri-original-imaefrhg65bmdahf.jpeg"", ""http://img6a.flixcart.com/image/air-freshener/d/e/k/01-liquid-itiha-20-set-of-2-potpourri-oil-combo-original-imaefrhfzzqtutgw.jpeg"", ""http://img5a.flixcart.com/image/air-freshener/x/p/4/01-liquid-itiha-20-set-of-two-oilsr-original-imaefsqtdg2kftkf.jpeg"", ""http://img6a.flixcart.com/image/air-freshener/z/a/f/01-liquid-itiha-20-set-of-2-potpourri-oil-combo-original-imaefsqyfuhg2hbu.jpeg""]",False,"Specifications of Itiha Home Liquid Air Freshener (20 ml) General Brand Itiha Quantity 20 ml Fragrance Mandarin, Fresh Roses Model ID 01 Color Multicolour Dimensions Weight 300 g In the Box Number of Contents in Sales Package Pack of 4 Sales Package 1 Mandarin Aroma Oil(10ml), 1 Fresh Roses Aroma Oil, 2 Potpourri Pouches (50 gms each)",No rating available,No rating available,Itiha,"{""product_specification""=>[{""key""=>""Brand"", ""value""=>""Itiha""}, {""key""=>""Quantity"", ""value""=>""20 ml""}, {""key""=>""Fragrance"", ""value""=>""Mandarin, Fresh Roses""}, {""key""=>""Model ID"", ""value""=>""01""}, {""key""=>""Color"", ""value""=>""Multicolour""}, {""key""=>""Weight"", ""value""=>""300 g""}, {""key""=>""Number of Contents in Sales Package"", ""value""=>""Pack of 4""}, {""key""=>""Sales Package"", ""value""=>""1 Mandarin Aroma Oil(10ml), 1 Fresh Roses Aroma Oil, 2 Potpourri Pouches (50 gms each)""}]}",home decor & festive needs | candles & fragrances | home fragrances | potpourri | itiha potpourri | itiha home liquid air freshener (20 ml),home decor & festive needs,itiha home liquid air freshener (20 ml),key brand value itiha key quantity value 20 ml key fragrance value mandarin fresh roses key model id value 01 key color value multicolour key weight value 300 key number contents sales package value pack key sales package value mandarin aroma oil 10ml fresh roses aroma oil potpourri pouches 50 gms,itiha home liquid air freshener,itiha,specifications itiha home liquid air freshener 20 ml general brand itiha quantity 20 ml fragrance mandarin fresh roses model id 01 color multicolour dimensions weight 300 box number contents sales package pack sales package mandarin aroma oil 10ml fresh roses aroma oil potpourri pouches 50 gms,home decor festive needs candles fragrances home fragrances potpourri itiha potpourri itiha home liquid air freshener 20 ml,itiha home liquid air freshener itiha home decor festive needs candles fragrances home fragrances potpourri itiha potpourri itiha home liquid air freshener 20 ml specifications itiha home liquid air freshener 20 ml general brand itiha quantity 20 ml fragrance mandarin fresh roses model id 01 color multicolour dimensions weight 300 box number contents sales package pack sales package mandarin aroma oil 10ml fresh roses aroma oil potpourri pouches 50 gms key brand value itiha key quantity value 20 ml key fragrance value mandarin fresh roses key model id value 01 key color value multicolour key weight value 300 key number contents sales package value pack key sales package value mandarin aroma oil 10ml fresh roses aroma oil potpourri pouches 50 gms
7c4fec2331da8d40f2cb146eb198cb57,2015-12-04 07:25:36 +0000,http://www.flipkart.com/disney-dw100405-digital-watch-boys/p/itmebyjafvbzhzzm?pid=WATEBYJABFE8WYTN,Disney DW100405 Digital Watch  - For Boys,"[""Watches >> Wrist Watches >> Disney Wrist Watches""]",WATEBYJABFE8WYTN,1495.0,1345.0,"[""http://img6a.flixcart.com/image/watch/y/t/n/dw100405-disney-original-imaebxxwznhxqkan.jpeg"", ""http://img6a.flixcart.com/image/watch/y/t/n/dw100405-disney-original-imaebxxyxmu53y5h.jpeg"", ""http://img5a.flixcart.com/image/watch/y/t/n/dw100405-disney-original-imaebxxyvzgemzf4.jpeg""]",False,"Disney DW100405 Digital Watch  - For Boys - Buy Disney DW100405 Digital Watch  - For Boys  DW100405 Online at Rs.1345 in India Only at Flipkart.com. - Great Discounts, Only Genuine Products, 30 Day Replacement Guarantee, Free Shipping. Cash On Delivery!",No rating available,No rating available,unknown,"{""product_specification""=>[{""key""=>""Chronograph"", ""value""=>""No""}, {""key""=>""Altimeter"", ""value""=>""Yes""}, {""key""=>""Date Display"", ""value""=>""Yes""}, {""key""=>""Barometer"", ""value""=>""No""}, {""key""=>""Alarm Clock"", ""value""=>""Yes""}, {""key""=>""Compass"", ""value""=>""No""}, {""key""=>""Calendar"", ""value""=>""No""}, {""key""=>""Luminous"", ""value""=>""No""}, {""key""=>""Type"", ""value""=>""Digital""}, {""key""=>""Style Code"", ""value""=>""DW100405""}, {""key""=>""Occasion"", ""value""=>""Casual""}, {""key""=>""Ideal For"", ""value""=>""Boys""}, {""key""=>""Novelty Feature"", ""value""=>""No""}, {""value""=>""6 Month""}, {""key""=>""Dial Shape"", ""value""=>""Round""}, {""key""=>""Strap Color"", ""value""=>""Black""}, {""key""=>""Scratch Resistant"", ""value""=>""No""}, {""key""=>""Water Resistant"", ""value""=>""Yes""}, {""key""=>""Dial Color"", ""value""=>""Black""}]}",watches | wrist watches | disney wrist watches,watches,disney wrist watches,key chronograph value key altimeter value yes key date display value yes key barometer value key alarm clock value yes key compass value key calendar value key luminous value key type value digital key style code value dw100405 key occasion value casual key ideal value boys key novelty feature value value month key dial shape value round key strap color value black key scratch resistant value key water resistant value yes key dial color value black,disney dw100405 digital watch boys,unknown,disney dw100405 digital watch boys buy disney dw100405 digital watch boys dw100405 online rs 1345 india flipkart com great discounts genuine products 30 day replacement guarantee free shipping cash delivery,watches wrist watches disney wrist watches,disney dw100405 digital watch boys unknown watches wrist watches disney wrist watches disney dw100405 digital watch boys buy disney dw100405 digital watch boys dw100405 online rs 1345 india flipkart com great discounts genuine products 30 day replacement guarantee free shipping cash delivery key chronograph value key altimeter value yes key date display value yes key barometer value key alarm clock value yes key compass value key calendar value key luminous value key type value digital key style code value dw100405 key occasion value casual key ideal value boys key novelty feature value value month key dial shape value round key strap color value black key scratch resistant value key water resistant value yes key dial color value black
c4528c68c2031d9ea7ec1d45fabbcfec,2016-01-01 19:37:22 +0000,http://www.flipkart.com/dailyobjects-back-cover-apple-ipad-2-3-4/p/itme9djy9gzunj2y?pid=ACCE9DJYJ9QX7EZZ,DailyObjects Back Cover for Apple iPad 2/3/4,"[""Mobiles & Accessories >> Tablet Accessories >> Cases & Covers >> DailyObjects Cases & Covers""]",ACCE9DJYJ9QX7EZZ,1999.0,1685.0,"[""http://img6a.flixcart.com/image/cases-covers/back-cover/e/z/z/dailyobjects-dailyobjects-let-go-of-regrets-case-for-ipad-2-3-4-1100x1100-imae9ch8j2tjdrjy.jpeg"", ""http://img5a.flixcart.com/image/cases-covers/back-cover/e/z/z/dailyobjects-dailyobjects-let-go-of-regrets-case-for-ipad-2-3-4-original-imae9ch8j2tjdrjy.jpeg""]",False,"DailyObjects Back Cover for Apple iPad 2/3/4 (White)
                         Price: Rs. 1,685
				
			About DailyObjects:
This slim back cover is a product of DailyObjects.com, India’s largest seller of designer and customisable smartphone cases. DailyObjects has a curated collection of exclusive licensed art that we have painstakingly sourced from artists that we love, from around the world. We currently have over 3000 amazing designs from over 50 artists from 25 countries across the world, available for more than 50 different models of smartphones.
About DailyObjects:
This slim back cover is a product of DailyObjects.com, India’s largest seller of designer and customisable smartphone cases. DailyObjects has a curated collection of exclusive licensed art that we have painstakingly sourced from artists that we love, from around the world. We currently have over 3000 amazing designs from over 50 artists from 25 countries across the world, available for more than 50 different models of smartphones.",No rating available,No rating available,DailyObjects,"{""product_specification""=>[{""key""=>""Brand"", ""value""=>""DailyObjects""}, {""key""=>""Shade"", ""value""=>""White""}, {""key""=>""Material"", ""value""=>""Plastic""}, {""key""=>""Designed for"", ""value""=>""Apple iPad 2/3/4""}, {""key""=>""Model ID"", ""value""=>""DailyObjects Let Go Of Regrets Case For iPad 2/3/4""}, {""key""=>""Color"", ""value""=>""White""}, {""key""=>""Covered in Warranty"", ""value""=>""Warranty of the Product is Limited to Manufacturing Defects Only""}, {""key""=>""Warranty Summary"", ""value""=>""1 Year Manufacturing Defects Warranty""}, {""key""=>""Warranty Service Type"", ""value""=>""Customer needs to call the nearby Authorized Service Center""}, {""key""=>""Sales Package"", ""value""=>""1 Back Cover""}]}",mobiles & accessories | tablet accessories | cases & covers | dailyobjects cases & covers,mobiles & accessories,dailyobjects cases & covers,key brand value dailyobjects key shade value white key material value plastic key designed value apple ipad key model id value dailyobjects let regrets case ipad key color value white key covered warranty value warranty product limited manufacturing defects key warranty summary value year manufacturing defects warranty key warranty service type value customer needs nearby authorized service center key sales package value cover,dailyobjects cover apple ipad,dailyobjects,dailyobjects cover apple ipad white price rs 685 dailyobjects slim cover product dailyobjects com indias largest seller designer customisable smartphone cases dailyobjects curated collection exclusive licensed art painstakingly sourced artists love world currently 3000 amazing designs 50 artists 25 countries world available 50 different models smartphones dailyobjects slim cover product dailyobjects com indias largest seller designer customisable smartphone cases dailyobjects curated collection exclusive licensed art painstakingly sourced artists love world currently 3000 amazing designs 50 artists 25 countries world available 50 different models smartphones,mobiles accessories tablet accessories cases covers dailyobjects cases covers,dailyobjects cover apple ipad dailyobjects mobiles accessories tablet accessories cases covers dailyobjects cases covers dailyobjects cover apple ipad white price rs 685 dailyobjects slim cover product dailyobjects com indias largest seller designer customisable smartphone cases dailyobjects curated collection exclusive licensed art painstakingly sourced artists love world currently 3000 amazing designs 50 artists 25 countries world available 50 different models smartphones dailyobjects slim cover product dailyobjects com indias largest seller designer customisable smartphone cases dailyobjects curated collection exclusive licensed art painstakingly sourced artists love world currently 3000 amazing designs 50 artists 25 countries world available 50 different models smartphones key brand value dailyobjects key shade value white key material value plastic key designed value apple ipad key model id value dailyobjects let regrets case ipad key color value white key covered warranty value warranty product limited manufacturing defects key warranty summary value year manufacturing defects warranty key warranty service type value customer needs nearby authorized service center key sales package value cover
