uniq_id,crawl_timestamp,product_url,product_name,product_category_tree,pid,retail_price,discounted_price,image,is_FK_Advantage_product,description,product_rating,overall_rating,brand,product_specifications,category_path,root_category,leaf_category,spec_text,clean_name,clean_brand,clean_description,clean_category,combined_text
fb9bd737763da54de772f7b3597c3726,2016-01-01 19:37:22 +0000,http://www.flipkart.com/mhk-pouch-apple-ipad-air-air-2-4th-generation-ipad-4/p/itmecndzstjbwfcp?pid=ACCECNDZTDXSE9F4,"MHK Pouch for Apple iPad Air, Apple iPad Air 2, Apple 4th Generation iPad, Apple iPad 4","[""Mobiles & Accessories >> Tablet Accessories >> Cases & Covers >> MHK Cases & Covers""]",ACCECNDZTDXSE9F4,2299.0,1199.0,"[""http://img6a.flixcart.com/image/cases-covers/pouch/9/f/4/mhk-ipbrch006-original-imaecnadjtcnewgm.jpeg"", ""http://img5a.flixcart.com/image/cases-covers/pouch/9/f/4/mhk-ipbrch006-original-imaecnadjtcnewgm.jpeg"", ""http://img5a.flixcart.com/image/cases-covers/pouch/9/f/4/mhk-ipbrch006-original-imaecnadvzamuddk.jpeg"", ""http://img6a.flixcart.com/image/cases-covers/pouch/9/f/4/mhk-ipbrch006-original-imaecnadg7y3xab5.jpeg"", ""http://img5a.flixcart.com/image/cases-covers/pouch/9/f/4/mhk-ipbrch006-original-imaecnadg3khggzg.jpeg""]",False,"MHK Pouch for Apple iPad Air, Apple iPad Air 2, Apple 4th Generation iPad, Apple iPad 4 (Brown)
                         Price: Rs. 1,199
				
			Not only can you protect your Apple Device from dings and scratches with this unique custom case, you can express your individuality with our stylish designs. This thin, lightweight, and durable case is made with an easy-to grip material that provides superior in-hand comfort. It also has precise custom-cut holes for full access to the buttons, speaker, headset jack, mic, camera lens, and flash. Slim fit and light weight, High Quality Plastic Protective Case, Keep your cell phone safe & protected in style, Slip your cell phone in to add a splash of color and deliver instant all around protection from scratches. All Our Cases are made of Artificial Leather, and approved by PETA.
Not only can you protect your Apple Device from dings and scratches with this unique custom case, you can express your individuality with our stylish designs. This thin, lightweight, and durable case is made with an easy-to grip material that provides superior in-hand comfort. It also has precise custom-cut holes for full access to the buttons, speaker, headset jack, mic, camera lens, and flash. Slim fit and light weight, High Quality Plastic Protective Case, Keep your cell phone safe & protected in style, Slip your cell phone in to add a splash of color and deliver instant all around protection from scratches. All Our Cases are made of Artificial Leather, and approved by PETA.",No rating available,No rating available,MHK,"{""product_specification""=>[{""key""=>""Brand"", ""value""=>""MHK""}, {""key""=>""Shade"", ""value""=>""Brown""}, {""key""=>""Material"", ""value""=>""Artificial Leather""}, {""key""=>""Designed for"", ""value""=>""Apple iPad Air, Apple iPad Air 2, Apple 4th Generation iPad, Apple iPad 4""}, {""key""=>""Model ID"", ""value""=>""IPBRCH006""}, {""key""=>""Color"", ""value""=>""Brown""}, {""key""=>""Sales Package"", ""value""=>""1 Tablet Pouch""}]}",mobiles & accessories | tablet accessories | cases & covers | mhk cases & covers,mobiles & accessories,mhk cases & covers,key brand value mhk key shade value brown key material value artificial leather key designed value apple ipad air apple ipad air apple 4th generation ipad apple ipad key model id value ipbrch006 key color value brown key sales package value tablet pouch,mhk pouch apple ipad air apple ipad air apple 4th generation ipad apple ipad,mhk,mhk pouch apple ipad air apple ipad air apple 4th generation ipad apple ipad brown price rs 199 protect apple device dings scratches unique custom case express individuality stylish designs lightweight durable case easy grip material provides superior hand comfort precise custom cut holes access buttons speaker headset jack mic camera lens flash slim fit light weight high quality plastic protective case cell phone safe protected style slip cell phone add splash color deliver instant protection scratches cases artificial leather approved peta protect apple device dings scratches unique custom case express individuality stylish designs lightweight durable case easy grip material provides superior hand comfort precise custom cut holes access buttons speaker headset jack mic camera lens flash slim fit light weight high quality plastic protective case cell phone safe protected style slip cell phone add splash color deliver instant protection scratches cases artificial leather approved peta,mobiles accessories tablet accessories cases covers mhk cases covers,mhk pouch apple ipad air apple ipad air apple 4th generation ipad apple ipad mhk mobiles accessories tablet accessories cases covers mhk cases covers mhk pouch apple ipad air apple ipad air apple 4th generation ipad apple ipad brown price rs 199 protect apple device dings scratches unique custom case express individuality stylish designs lightweight durable case easy grip material provides superior hand comfort precise custom cut holes access buttons speaker headset jack mic camera lens flash slim fit light weight high quality plastic protective case cell phone safe protected style slip cell phone add splash color deliver instant protection scratches cases artificial leather approved peta protect apple device dings scratches unique custom case express individuality stylish designs lightweight durable case easy grip material provides superior hand comfort precise custom cut holes access buttons speaker headset jack mic camera lens flash slim fit light weight high quality plastic protective case cell phone safe protected style slip cell phone add splash color deliver instant protection scratches cases artificial leather approved peta key brand value mhk key shade value brown key material value artificial leather key designed value apple ipad air apple ipad air apple 4th generation ipad apple ipad key model id value ipbrch006 key color value brown key sales package value tablet pouch
c0485cb5ca480d53eb6a3d235c65c297,2015-12-01 12:40:44 +0000,http://www.flipkart.com/allure-auto-cm-714-car-mat-chevrolet-cruze/p/itmecn2q9rmakvy7?pid=CRTECN2QUCSMF4SX,Allure Auto CM 714 Car Mat Chevrolet Cruze,"[""Automotive >> Accessories & Spare parts >> Car Interior & Exterior >> Car Interior >> Car Mats""]",CRTECN2QUCSMF4SX,4200.0,1380.0,"[""http://img6a.flixcart.com/image/car-mat/e/k/5/fiat-punto-evo-rubber-mats-transparent-allure-auto-cm-730-1100x1100-imaecjxkskucjg65.jpeg"", ""http://img6a.flixcart.com/image/car-mat/e/k/5/fiat-punto-evo-rubber-mats-transparent-allure-auto-cm-730-original-imaecjxkskucjg65.jpeg""]",False,Buy Allure Auto CM 714 Car Mat Chevrolet Cruze for Rs.1380 online. Allure Auto CM 714 Car Mat Chevrolet Cruze at best prices with FREE shipping & cash on delivery. Only Genuine Products. 30 Day Replacement Guarantee.,No rating available,No rating available,Allure Auto,"{""product_specification""=>[{""key""=>""Brand"", ""value""=>""Allure Auto""}, {""key""=>""Model Year"", ""value""=>""NA""}, {""key""=>""Vehicle Model Name"", ""value""=>""Cruze""}, {""key""=>""Model Number"", ""value""=>""Chevrolet Cruze - Rubber Mats ( Transparent)""}, {""key""=>""Vehicle Brand"", ""value""=>""Chevrolet""}, {""key""=>""Type"", ""value""=>""Floor Mat""}, {""key""=>""Material"", ""value""=>""Rubber""}, {""key""=>""Model Name"", ""value""=>""CM 714""}, {""key""=>""Color"", ""value""=>""Clear""}, {""key""=>""Sales Package"", ""value""=>""Set of 4 Car Floor Mats""}, {""key""=>""Pack of"", ""value""=>""4""}]}",automotive | accessories & spare parts | car interior & exterior | car interior | car mats,automotive,car mats,key brand value allure auto key model year value na key vehicle model value cruze key model number value chevrolet cruze rubber mats transparent key vehicle brand value chevrolet key type value floor mat key material value rubber key model value cm 714 key color value clear key sales package value set car floor mats key pack value,allure auto cm 714 car mat chevrolet cruze,allure auto,buy allure auto cm 714 car mat chevrolet cruze rs 1380 online allure auto cm 714 car mat chevrolet cruze best prices free shipping cash delivery genuine products 30 day replacement guarantee,automotive accessories spare parts car interior exterior car interior car mats,allure auto cm 714 car mat chevrolet cruze allure auto automotive accessories spare parts car interior exterior car interior car mats buy allure auto cm 714 car mat chevrolet cruze rs 1380 online allure auto cm 714 car mat chevrolet cruze best prices free shipping cash delivery genuine products 30 day replacement guarantee key brand value allure auto key model year value na key vehicle model value cruze key model number value chevrolet cruze rubber mats transparent key vehicle brand value chevrolet key type value floor mat key material value rubber key model value cm 714 key color value clear key sales package value set car floor mats key pack value
5fdb912462da9891e5b21c677ceb15e4,2016-06-26 09:25:14 +0000,http://www.flipkart.com/brass-gift-center-showpiece-48-cm/p/itmejy5hgafsbgf9?pid=SHIEJY5HPVJT9MUE,brass gift center Showpiece  -  48 cm,"[""Home Decor & Festive Needs >> Religion & Devotion >> brass gift center Religion & Devotion >> brass gift center Showpiece  -  48 cm (Brass, Mu...""]",SHIEJY5HPVJT9MUE,7999.0,4550.0,"[""http://img5a.flixcart.com/image/showpiece-figurine/m/u/e/lady-statu-showpiece-brass-gift-center-1100x1100-imaejxzfwngkgggz.jpeg"", ""http://img6a.flixcart.com/image/showpiece-figurine/m/u/e/lady-statu-showpiece-brass-gift-center-original-imaejxzfwngkgggz.jpeg"", ""http://img5a.flixcart.com/image/showpiece-figurine/m/u/e/lady-statu-showpiece-brass-gift-center-original-imaejxzhcgejhu7n.jpeg""]",False,"Key Features of brass gift center Showpiece  -  48 cm Brass Height - 48 cm Width - 12 cm Weight - 3700 g,Specifications of brass gift center Showpiece  -  48 cm (Brass, Multicolor) General Brand brass gift center Model Number lady statu showpiece Type Human Figurines Material Brass Color Multicolor Dimensions Weight 3700 g Height 48 cm Width 12 cm Depth 12 cm In the Box Sales Package one piece of statu",No rating available,No rating available,brass gift center,"{""product_specification""=>[{""key""=>""Brand"", ""value""=>""brass gift center""}, {""key""=>""Model Number"", ""value""=>""lady statu showpiece""}, {""key""=>""Type"", ""value""=>""Human Figurines""}, {""key""=>""Material"", ""value""=>""Brass""}, {""key""=>""Color"", ""value""=>""Multicolor""}, {""key""=>""Weight"", ""value""=>""3700 g""}, {""key""=>""Height"", ""value""=>""48 cm""}, {""key""=>""Width"", ""value""=>""12 cm""}, {""key""=>""Depth"", ""value""=>""12 cm""}, {""key""=>""Sales Package"", ""value""=>""one piece of statu""}]}","home decor & festive needs | religion & devotion | brass gift center religion & devotion | brass gift center showpiece  -  48 cm (brass, mu...",home decor & festive needs,"brass gift center showpiece  -  48 cm (brass, mu...",key brand value brass gift center key model number value lady statu showpiece key type value human figurines key material value brass key color value multicolor key weight value 3700 key height value 48 cm key width value 12 cm key depth value 12 cm key sales package value piece statu,brass gift center showpiece 48 cm,brass gift center,key features brass gift center showpiece 48 cm brass height 48 cm width 12 cm weight 3700 specifications brass gift center showpiece 48 cm brass multicolor general brand brass gift center model number lady statu showpiece type human figurines material brass color multicolor dimensions weight 3700 height 48 cm width 12 cm depth 12 cm box sales package piece statu,home decor festive needs religion devotion brass gift center religion devotion brass gift center showpiece 48 cm brass mu,brass gift center showpiece 48 cm brass gift center home decor festive needs religion devotion brass gift center religion devotion brass gift center showpiece 48 cm brass mu key features brass gift center showpiece 48 cm brass height 48 cm width 12 cm weight 3700 specifications brass gift center showpiece 48 cm brass multicolor general brand brass gift center model number lady statu showpiece type human figurines material brass color multicolor dimensions weight 3700 height 48 cm width 12 cm depth 12 cm box sales package piece statu key brand value brass gift center key model number value lady statu showpiece key type value human figurines key material value brass key color value multicolor key weight value 3700 key height value 48 cm key width value 12 cm key depth value 12 cm key sales package value piece statu
06c75f30f1b28273c4d3b0df8f2e8eb8,2015-12-04 07:25:36 +0000,http://www.flipkart.com/steppings-trendy-boots/p/itme96vehnsegwvg?pid=SHOE2GUJW6XNFG3W,Steppings Trendy Boots,"[""Footwear >> Women's Footwear >> Casual Shoes >> Boots""]",SHOE2GUJW6XNFG3W,2199.0,1099.0,"[""http://img6a.flixcart.com/image/shoe/g/3/w/black-ml-4-steppings-38-1100x1360-imae2censqgcxgcg.jpeg"", ""http://img5a.flixcart.com/image/shoe/g/3/w/black-ml-4-steppings-38-original-imae2censqgcxgcg.jpeg"", ""http://img6a.flixcart.com/image/shoe/g/3/w/black-ml-4-steppings-38-original-imae2cenv2sq5mfd.jpeg"", ""http://img6a.flixcart.com/image/shoe/g/3/w/black-ml-4-steppings-38-original-imae2cengdkrjq58.jpeg"", ""http://img6a.flixcart.com/image/shoe/g/3/w/black-ml-4-steppings-38-original-imae2cenhqsbvwmn.jpeg"", ""http://img6a.flixcart.com/image/shoe/g/3/w/black-ml-4-steppings-38-original-imae2cengcyuzxeu.jpeg""]",False,Steppings Trendy Boots - Buy Steppings Trendy Boots - ML-4 only for Rs. 1099 from Flipkart.com. Only Genuine Products. 30 Day Replacement Guarantee. Free Shipping. Cash On Delivery!,No rating available,No rating available,unknown,"{""product_specification""=>[{""key""=>""Occasion"", ""value""=>""Casual""}, {""key""=>""Ideal For"", ""value""=>""Women""}, {""key""=>""Heel Height"", ""value""=>""0 inch""}, {""key""=>""Outer Material"", ""value""=>""Artificial Leather""}, {""key""=>""Color"", ""value""=>""Black""}, {""value""=>""1 Pair of Footwear""}, {""key""=>""Care Instructions"", ""value""=>""Wipe With Clean Dry Cloth To Keep Clean""}]}",footwear | women's footwear | casual shoes | boots,footwear,boots,key occasion value casual key ideal value women key heel height value inch key outer material value artificial leather key color value black value pair footwear key care instructions value wipe clean dry cloth clean,steppings trendy boots,unknown,steppings trendy boots buy steppings trendy boots ml rs 1099 flipkart com genuine products 30 day replacement guarantee free shipping cash delivery,footwear women footwear casual shoes boots,steppings trendy boots unknown footwear women footwear casual shoes boots steppings trendy boots buy steppings trendy boots ml rs 1099 flipkart com genuine products 30 day replacement guarantee free shipping cash delivery key occasion value casual key ideal value women key heel height value inch key outer material value artificial leather key color value black value pair footwear key care instructions value wipe clean dry cloth clean
133e21485906fe9da43ea63117acf7fa,2015-12-01 12:40:44 +0000,http://www.flipkart.com/voylla-metal-alloy-necklace/p/itmdu4rzfy7gyghf?pid=NKCDU4RZFY7GYGHF,"Voylla Metal, Alloy Necklace","[""Jewellery >> Necklaces & Chains >> Necklaces""]",NKCDU4RZFY7GYGHF,600.0,478.0,"[""http://img6a.flixcart.com/image/necklace-chain/g/h/f/abpnq20206-voylla-necklace-1100x1100-imadu4t5qn7zvuzw.jpeg"", ""http://img5a.flixcart.com/image/necklace-chain/g/h/f/abpnq20206-voylla-necklace-original-imadu4t5qn7zvuzw.jpeg"", ""http://img5a.flixcart.com/image/necklace-chain/g/h/f/abpnq20206-voylla-necklace-original-imadu4t4fysaddrw.jpeg""]",False,"Voylla Metal, Alloy Necklace - Buy Voylla Metal, Alloy Necklace only for Rs. 478 from Flipkart.com. Only Genuine Products. 30 Day Replacement Guarantee. Free Shipping. Cash On Delivery!",No rating available,No rating available,Voylla,"{""product_specification""=>[{""key""=>""Brand"", ""value""=>""Voylla""}, {""key""=>""Precious/Artificial Jewellery"", ""value""=>""Fashion Jewellery""}, {""key""=>""Model Number"", ""value""=>""ABPNQ20206""}, {""key""=>""Type"", ""value""=>""Necklace""}, {""key""=>""Occasion"", ""value""=>""Everyday""}, {""key""=>""Ideal For"", ""value""=>""Women""}, {""key""=>""Color"", ""value""=>""Black, White""}, {""key""=>""Base Material"", ""value""=>""Metal, Alloy""}, {""key""=>""Necklace Type"", ""value""=>""Beaded""}, {""key""=>""Certification"", ""value""=>""NA""}, {""key""=>""Sales Package"", ""value""=>""1 Necklace""}, {""key""=>""Pack of"", ""value""=>""1""}]}",jewellery | necklaces & chains | necklaces,jewellery,necklaces,key brand value voylla key precious artificial jewellery value fashion jewellery key model number value abpnq20206 key type value necklace key occasion value everyday key ideal value women key color value black white key base material value metal alloy key necklace type value beaded key certification value na key sales package value necklace key pack value,voylla metal alloy necklace,voylla,voylla metal alloy necklace buy voylla metal alloy necklace rs 478 flipkart com genuine products 30 day replacement guarantee free shipping cash delivery,jewellery necklaces chains necklaces,voylla metal alloy necklace voylla jewellery necklaces chains necklaces voylla metal alloy necklace buy voylla metal alloy necklace rs 478 flipkart com genuine products 30 day replacement guarantee free shipping cash delivery key brand value voylla key precious artificial jewellery value fashion jewellery key model number value abpnq20206 key type value necklace key occasion value everyday key ideal value women key color value black white key base material value metal alloy key necklace type value beaded key certification value na key sales package value necklace key pack value
eb44948746e551a856e4dd9d0a6c7a75,2016-03-21 02:58:41 +0000,http://www.flipkart.com/addiction-floral-print-women-s-straight-kurta/p/itmegyzpyye4chqy?pid=KTAEGYZPAWSNTKGM,ADDICTION Floral Print Women's Straight Kurta,"[""Clothing >> Women's Clothing >> Ethnic Wear >> Kurtas & Kurtis >> Kurtas >> ADDICTION Kurtas >> ADDICTION Floral Print Women's Straight Kurta""]",KTAEGYZPAWSNTKGM,900.0,450.0,"[""http://img5a.flixcart.com/image/kurta/t/w/7/add175-addiction-xs-original-imaegymxdbdscepq.jpeg"", ""http://img6a.flixcart.com/image/kurta/t/w/7/add175-addiction-xs-original-imaegymxdbdscepq.jpeg"", ""http://img6a.flixcart.com/image/kurta/t/w/7/add175-addiction-xs-original-imaegymxvhxtv7jp.jpeg"", ""http://img5a.flixcart.com/image/kurta/t/w/7/add175-addiction-xxl-original-imaegymxgnrwjmz5.jpeg"", ""http://img5a.flixcart.com/image/kurta/t/w/7/add175-addiction-xxl-original-imaegymxcrbydzwz.jpeg"", ""http://img6a.flixcart.com/image/kurta/t/w/7/add175-addiction-xxl-original-imaegymxztsvhqsg.jpeg""]",False,"Key Features of ADDICTION Floral Print Women's Straight Kurta Dark red, gold Straight,ADDICTION Floral Print Women's Straight Kurta Price: Rs. 450 Add an oomph and exclusivity to your look with some designer wear clothing, from the house of ADDICTION presenting finely crafted apparels that are must haves! A perfect choice for those looking for a contemporary look with a slight twist. Fabricated in cotton, the painterly red colour, the smart round neck with v-slit, the beauteous 3/4 sleeve and the showy mid length are just perfect details for this straight kurta. That makes it a perfect casual pick. A must buy!,Specifications of ADDICTION Floral Print Women's Straight Kurta General Details Pattern Floral Print Ideal For Women's Occasion Casual Kurta Details Sleeve 3/4 Sleeve Number of Contents in Sales Package Pack of 1 Fabric Cotton Type Straight Neck Round Neck with V-slit Fabric Care Hand wash separately in cold water Additional Details Style Code ADD175 In the Box 1 Kurta",No rating available,No rating available,ADDICTION,"{""product_specification""=>[{""key""=>""Pattern"", ""value""=>""Floral Print""}, {""key""=>""Ideal For"", ""value""=>""Women's""}, {""key""=>""Occasion"", ""value""=>""Casual""}, {""key""=>""Sleeve"", ""value""=>""3/4 Sleeve""}, {""key""=>""Number of Contents in Sales Package"", ""value""=>""Pack of 1""}, {""key""=>""Fabric"", ""value""=>""Cotton""}, {""key""=>""Type"", ""value""=>""Straight""}, {""key""=>""Neck"", ""value""=>""Round Neck with V-slit""}, {""value""=>""Hand wash separately in cold water""}, {""key""=>""Style Code"", ""value""=>""ADD175""}, {""value""=>""1 Kurta""}]}",clothing | women's clothing | ethnic wear | kurtas & kurtis | kurtas | addiction kurtas | addiction floral print women's straight kurta,clothing,addiction floral print women's straight kurta,key pattern value floral print key ideal value women key occasion value casual key sleeve value sleeve key number contents sales package value pack key fabric value cotton key type value straight key neck value round neck slit value hand wash separately cold water key style code value add175 value kurta,addiction floral print women straight kurta,addiction,key features addiction floral print women straight kurta dark red gold straight addiction floral print women straight kurta price rs 450 add oomph exclusivity look designer wear clothing house addiction presenting finely crafted apparels haves perfect choice looking contemporary look slight twist fabricated cotton painterly red colour smart round neck slit beauteous sleeve showy mid length just perfect details straight kurta makes perfect casual pick buy specifications addiction floral print women straight kurta general details pattern floral print ideal women occasion casual kurta details sleeve sleeve number contents sales package pack fabric cotton type straight neck round neck slit fabric care hand wash separately cold water additional details style code add175 box kurta,clothing women clothing ethnic wear kurtas kurtis kurtas addiction kurtas addiction floral print women straight kurta,addiction floral print women straight kurta addiction clothing women clothing ethnic wear kurtas kurtis kurtas addiction kurtas addiction floral print women straight kurta key features addiction floral print women straight kurta dark red gold straight addiction floral print women straight kurta price rs 450 add oomph exclusivity look designer wear clothing house addiction presenting finely crafted apparels haves perfect choice looking contemporary look slight twist fabricated cotton painterly red colour smart round neck slit beauteous sleeve showy mid length just perfect details straight kurta makes perfect casual pick buy specifications addiction floral print women straight kurta general details pattern floral print ideal women occasion casual kurta details sleeve sleeve number contents sales package pack fabric cotton type straight neck round neck slit fabric care hand wash separately cold water additional details style code add175 box kurta key pattern value floral print key ideal value women key occasion value casual key sleeve value sleeve key number contents sales package value pack key fabric value cotton key type value straight key neck value round neck slit value hand wash separately cold water key style code value add175 value kurta
