uniq_id,crawl_timestamp,product_url,product_name,product_category_tree,pid,retail_price,discounted_price,image,is_FK_Advantage_product,description,product_rating,overall_rating,brand,product_specifications,category_path,root_category,leaf_category,spec_text,clean_name,clean_brand,clean_description,clean_category,combined_text
02a99955e018f312026ea6762f9b9bc7,2015-12-01 12:40:44 +0000,http://www.flipkart.com/vinnis-rolling-starlight-plastic-metal-necklace/p/itmdyarbjg6fpygv?pid=NKCDYARBBBGJ3WGG,"Vinnis Rolling Starlight Plastic, Metal Necklace","[""Jewellery >> Necklaces & Chains >> Necklaces""]",NKCDYARBBBGJ3WGG,499.0,299.0,"[""http://img6a.flixcart.com/image/necklace-chain/w/g/g/vc1085whn-vinnis-necklace-original-imadyb5d8awdmwzx.jpeg"", ""http://img5a.flixcart.com/image/necklace-chain/w/g/g/vc1085whn-vinnis-necklace-original-imadyb5d8awdmwzx.jpeg"", ""http://img6a.flixcart.com/image/necklace-chain/w/g/g/vc1085whn-vinnis-necklace-original-imadyb5dga3cxw4c.jpeg"", ""http://img6a.flixcart.com/image/necklace-chain/w/g/g/vc1085whn-vinnis-necklace-original-imadyb5du3mpr3mg.jpeg""]",False,"Vinnis Rolling Starlight Plastic, Metal Necklace - Buy Vinnis Rolling Starlight Plastic, Metal Necklace only for Rs. 299 from Flipkart.com. Only Genuine Products. 30 Day Replacement Guarantee. Free Shipping. Cash On Delivery!",No rating available,No rating available,Vinnis,"{""product_specification""=>[{""key""=>""Brand"", ""value""=>""Vinnis""}, {""key""=>""Collection"", ""value""=>""Ethnic""}, {""key""=>""Model Number"", ""value""=>""VC1085WHN""}, {""key""=>""Precious/Artificial Jewellery"", ""value""=>""Fashion Jewellery""}, {""key""=>""Type"", ""value""=>""Necklace""}, {""key""=>""Model Name"", ""value""=>""Rolling Starlight""}, {""key""=>""Ideal For"", ""value""=>""Women, Girls""}, {""key""=>""Occasion"", ""value""=>""Wedding and Engagement, Everyday, Workwear, Wedding and Engagement""}, {""key""=>""Color"", ""value""=>""White, Gold""}, {""key""=>""Chain/Necklace Length"", ""value""=>""12 inch""}, {""key""=>""Weight"", ""value""=>""100 g""}, {""key""=>""Base Material"", ""value""=>""Plastic, Metal""}, {""key""=>""Necklace Type"", ""value""=>""Matinee Necklace""}, {""key""=>""Chain Type"", ""value""=>""Belcher""}, {""key""=>""Finish"", ""value""=>""Glossy""}, {""key""=>""Sales Package"", ""value""=>""1 Neclace""}, {""key""=>""Pack of"", ""value""=>""1""}]}",jewellery | necklaces & chains | necklaces,jewellery,necklaces,key brand value vinnis key collection value ethnic key model number value vc1085whn key precious artificial jewellery value fashion jewellery key type value necklace key model value rolling starlight key ideal value women girls key occasion value wedding engagement everyday workwear wedding engagement key color value white gold key chain necklace length value 12 inch key weight value 100 key base material value plastic metal key necklace type value matinee necklace key chain type value belcher key finish value glossy key sales package value neclace key pack value,vinnis rolling starlight plastic metal necklace,vinnis,vinnis rolling starlight plastic metal necklace buy vinnis rolling starlight plastic metal necklace rs 299 flipkart com genuine products 30 day replacement guarantee free shipping cash delivery,jewellery necklaces chains necklaces,vinnis rolling starlight plastic metal necklace vinnis jewellery necklaces chains necklaces vinnis rolling starlight plastic metal necklace buy vinnis rolling starlight plastic metal necklace rs 299 flipkart com genuine products 30 day replacement guarantee free shipping cash delivery key brand value vinnis key collection value ethnic key model number value vc1085whn key precious artificial jewellery value fashion jewellery key type value necklace key model value rolling starlight key ideal value women girls key occasion value wedding engagement everyday workwear wedding engagement key color value white gold key chain necklace length value 12 inch key weight value 100 key base material value plastic metal key necklace type value matinee necklace key chain type value belcher key finish value glossy key sales package value neclace key pack value
0440b6f721adde72b341d15fe8d2b865,2016-03-05 04:18:53 +0000,http://www.flipkart.com/kits-kart-pouch-blu-win-hd-lte/p/itmegh6qdgsjztby?pid=ACCEGH6QCJSFGH6W,kits kart Pouch for BLU Win HD LTE,"[""Mobiles & Accessories >> Mobile Accessories >> Mobile Pouches >> kits kart Mobile Pouches >> kits kart Pouch for BLU Win HD LTE (Red)""]",ACCEGH6QCJSFGH6W,908.0,454.0,"[""http://img6a.flixcart.com/image/cases-covers/pouch/v/y/6/kits-kart-hdprd50-1841-1100x1100-imaeggy8gcswgq5d.jpeg"", ""http://img6a.flixcart.com/image/cases-covers/pouch/v/y/6/kits-kart-hdprd50-1841-original-imaeggy8gcswgq5d.jpeg"", ""http://img5a.flixcart.com/image/cases-covers/pouch/p/d/f/kits-kart-hdprd55-1388-original-imaeggy8agwwgjkg.jpeg"", ""http://img5a.flixcart.com/image/cases-covers/pouch/d/h/z/kits-kart-hdprd47-1593-original-imaeggy8afetgr5y.jpeg"", ""http://img6a.flixcart.com/image/cases-covers/pouch/h/f/k/kits-kart-hdprd50-0979-original-imaeggy82xjeuv4r.jpeg"", ""http://img5a.flixcart.com/image/cases-covers/pouch/a/q/h/kits-kart-hdprd47-1555-original-imaeggy8hd88s3bh.jpeg""]",False,"Key Features of kits kart Pouch for BLU Win HD LTE Durable Protective Light Weight Easy To Use,kits kart Pouch for BLU Win HD LTE (Red) Price: Rs. 454 Product Description for : BLU Win HD LTE - HDPRD50#0241 - Keeps your Mobile safe in executive style in the Leather case. Ultimate protection for your mobile. Protects your Mobile from any harm without impacting its super slim profile. Protects the screen of your mobile from Scratches & Cracks. This cover slides your device completely inside. Your Mobile screen is strongly protected without adding any thickness and weight normally associated with other cases. Made from high quality Leather & would help you will keep your Mobile looking good as new. The cover is tough enough to withstand day-to-day hassles without and strain, and helps your phone stay well for long. Product at Glimpse 1) Exclusively designed for your smartphone. 2) Light weight and durable construction. 3) Extremely tough, durable case molds perfectly to your phones shape. 4) Easy to Use, durable construction and premium quality""PLEASE LEAVE A GOOD POSITIVE FEEDBACK WITH 5 DETAILED SELLER RATING ONCE YOU ARE SATISFIED"" If your not satisfied with our product or any other issues regarding the product and you are feeling to give an negative remark, We humbly request you to give us a call or mail us so that we could promptly resolve your issue. You could call us @ 9176695600 or mail us at kitskart@gmail.com,Specifications of kits kart Pouch for BLU Win HD LTE (Red) General Brand kits kart Shade Red Material Artificial Leather Designed for BLU Win HD LTE Model ID HDPRD50#0241 Color Red In the Box Sales Package 1 Hand Pouch",No rating available,No rating available,kits kart,"{""product_specification""=>[{""key""=>""Brand"", ""value""=>""kits kart""}, {""key""=>""Shade"", ""value""=>""Red""}, {""key""=>""Material"", ""value""=>""Artificial Leather""}, {""key""=>""Designed for"", ""value""=>""BLU Win HD LTE""}, {""key""=>""Model ID"", ""value""=>""HDPRD50#0241""}, {""key""=>""Color"", ""value""=>""Red""}, {""key""=>""Sales Package"", ""value""=>""1 Hand Pouch""}]}",mobiles & accessories | mobile accessories | mobile pouches | kits kart mobile pouches | kits kart pouch for blu win hd lte (red),mobiles & accessories,kits kart pouch for blu win hd lte (red),key brand value kits kart key shade value red key material value artificial leather key designed value blu win hd lte key model id value hdprd50 0241 key color value red key sales package value hand pouch,kits kart pouch blu win hd lte,kits kart,key features kits kart pouch blu win hd lte durable protective light weight easy use kits kart pouch blu win hd lte red price rs 454 product description blu win hd lte hdprd50 0241 keeps mobile safe executive style leather case ultimate protection mobile protects mobile harm impacting super slim profile protects screen mobile scratches cracks cover slides device completely inside mobile screen strongly protected adding thickness weight normally associated cases high quality leather help mobile looking good new cover tough withstand day day hassles strain helps phone stay long product glimpse exclusively designed smartphone light weight durable construction extremely tough durable case molds perfectly phones shape easy use durable construction premium quality leave good positive feedback detailed seller rating satisfied satisfied product issues regarding product feeling negative remark humbly request mail promptly resolve issue 9176695600 mail kitskart gmail com specifications kits kart pouch blu win hd lte red general brand kits kart shade red material artificial leather designed blu win hd lte model id hdprd50 0241 color red box sales package hand pouch,mobiles accessories mobile accessories mobile pouches kits kart mobile pouches kits kart pouch blu win hd lte red,kits kart pouch blu win hd lte kits kart mobiles accessories mobile accessories mobile pouches kits kart mobile pouches kits kart pouch blu win hd lte red key features kits kart pouch blu win hd lte durable protective light weight easy use kits kart pouch blu win hd lte red price rs 454 product description blu win hd lte hdprd50 0241 keeps mobile safe executive style leather case ultimate protection mobile protects mobile harm impacting super slim profile protects screen mobile scratches cracks cover slides device completely inside mobile screen strongly protected adding thickness weight normally associated cases high quality leather help mobile looking good new cover tough withstand day day hassles strain helps phone stay long product glimpse exclusively designed smartphone light weight durable construction extremely tough durable case molds perfectly phones shape easy use durable construction premium quality leave good positive feedback detailed seller rating satisfied satisfied product issues regarding product feeling negative remark humbly request mail promptly resolve issue 9176695600 mail kitskart gmail com specifications kits kart pouch blu win hd lte red general brand kits kart shade red material artificial leather designed blu win hd lte model id hdprd50 0241 color red box sales package hand pouch key brand value kits kart key shade value red key material value artificial leather key designed value blu win hd lte key model id value hdprd50 0241 key color value red key sales package value hand pouch
203860575c7e91e6cf6e30856f573275,2015-12-03 21:49:05 +0000,http://www.flipkart.com/dyna-silver-heart-stereo-wireless-bluetooth-headset/p/itmebvt5ygjprey8?pid=ACCEBVT585S73BEW,Dyna Silver Heart Stereo Wireless Bluetooth Headset,"[""Mobiles & Accessories >> Mobile Accessories >> Dyna Mobile Accessories""]",ACCEBVT585S73BEW,3299.0,1849.0,"[""http://img5a.flixcart.com/image/headset/b/e/w/dyna-silver-heart-stereo-1100x1100-imaebuwjpywmaxyg.jpeg"", ""http://img5a.flixcart.com/image/headset/b/e/w/dyna-silver-heart-stereo-original-imaebuwjpywmaxyg.jpeg"", ""http://img6a.flixcart.com/image/headset/b/e/w/dyna-silver-heart-stereo-original-imaebuwjjneznhgs.jpeg"", ""http://img5a.flixcart.com/image/headset/b/e/w/dyna-silver-heart-stereo-original-imaebuwk9eghddwy.jpeg"", ""http://img6a.flixcart.com/image/headset/b/e/w/dyna-silver-heart-stereo-original-imaebvmapagnrb2p.jpeg""]",False,Buy Dyna Silver Heart Stereo Wireless Bluetooth Headset only for Rs. 1849 from Flipkart.com. Only Genuine Products. 30 Day Replacement Guarantee. Free Shipping. Cash On Delivery!,No rating available,No rating available,Dyna,"{""product_specification""=>[{""key""=>""Talk Time"", ""value""=>""360 min""}, {""key""=>""Stand-by Time"", ""value""=>""80 hr""}, {""key""=>""Charge Time"", ""value""=>""1""}, {""key""=>""Headset Design"", ""value""=>""Earbud""}, {""key""=>""Brand"", ""value""=>""Dyna""}, {""key""=>""Wired/Wireless"", ""value""=>""Wireless""}, {""key""=>""Compatible Devices"", ""value""=>""Audio Player, Tablet, Musical Instrument, Television, Mobile, Computer""}, {""key""=>""Type of Headset"", ""value""=>""In the Ear""}, {""key""=>""Model ID"", ""value""=>""Silver Heart Stereo""}, {""key""=>""In Sales Package"", ""value""=>""Bluetooth Headset, Stereo Earphone, USB Cable, User Manual""}, {""key""=>""Color"", ""value""=>""White""}, {""key""=>""Call Controls"", ""value""=>""Answer/End Call, Reject, Voice Dialing""}, {""key""=>""Bluetooth Version"", ""value""=>""4""}, {""key""=>""Bluetooth"", ""value""=>""Yes""}, {""key""=>""Bluetooth Profile"", ""value""=>""HFP vl.2 Wideband Speech (HD Voice Ready), HSP vl.2, A2DP vl.2, AVRCP vl.4, CVC Version 6.0""}, {""key""=>""Noise Cancellation Headphones"", ""value""=>""Yes""}, {""key""=>""Wireless Type"", ""value""=>""Bluetooth""}, {""key""=>""Wireless Range"", ""value""=>""10""}, {""key""=>""Weight"", ""value""=>""7 g""}, {""key""=>""Covered in Warranty"", ""value""=>""Manufacturing Defects""}, {""key""=>""Warranty Summary"", ""value""=>""3 Month Dyna Warranty""}, {""key""=>""Warranty Service Type"", ""value""=>""On-Site Replacement""}, {""key""=>""Not Covered in Warranty"", ""value""=>""Used and Physically Damaged""}, {""key""=>""Boom Microphone"", ""value""=>""No""}, {""key""=>""Noise Cancellation Mircrophone"", ""value""=>""Yes""}, {""key""=>""Microphone Type"", ""value""=>""Mono""}]}",mobiles & accessories | mobile accessories | dyna mobile accessories,mobiles & accessories,dyna mobile accessories,key talk time value 360 min key stand time value 80 hr key charge time value key headset design value earbud key brand value dyna key wired wireless value wireless key compatible devices value audio player tablet musical instrument television mobile computer key type headset value ear key model id value silver heart stereo key sales package value bluetooth headset stereo earphone usb cable user manual key color value white key controls value answer end reject voice dialing key bluetooth version value key bluetooth value yes key bluetooth profile value hfp vl wideband speech hd voice ready hsp vl a2dp vl avrcp vl cvc version key noise cancellation headphones value yes key wireless type value bluetooth key wireless range value 10 key weight value key covered warranty value manufacturing defects key warranty summary value month dyna warranty key warranty service type value site replacement key covered warranty value used physically damaged key boom microphone value key noise cancellation mircrophone value yes key microphone type value mono,dyna silver heart stereo wireless bluetooth headset,dyna,buy dyna silver heart stereo wireless bluetooth headset rs 1849 flipkart com genuine products 30 day replacement guarantee free shipping cash delivery,mobiles accessories mobile accessories dyna mobile accessories,dyna silver heart stereo wireless bluetooth headset dyna mobiles accessories mobile accessories dyna mobile accessories buy dyna silver heart stereo wireless bluetooth headset rs 1849 flipkart com genuine products 30 day replacement guarantee free shipping cash delivery key talk time value 360 min key stand time value 80 hr key charge time value key headset design value earbud key brand value dyna key wired wireless value wireless key compatible devices value audio player tablet musical instrument television mobile computer key type headset value ear key model id value silver heart stereo key sales package value bluetooth headset stereo earphone usb cable user manual key color value white key controls value answer end reject voice dialing key bluetooth version value key bluetooth value yes key bluetooth profile value hfp vl wideband speech hd voice ready hsp vl a2dp vl avrcp vl cvc version key noise cancellation headphones value yes key wireless type value bluetooth key wireless range value 10 key weight value key covered warranty value manufacturing defects key warranty summary value month dyna warranty key warranty service type value site replacement key covered warranty value used physically damaged key boom microphone value key noise cancellation mircrophone value yes key microphone type value mono
1a4395c87d27c120353cebd634f5b670,2016-01-07 00:54:41 +0000,http://www.flipkart.com/meish-casual-short-sleeve-embellished-women-s-top/p/itmebrc6q7wfxzkd?pid=TOPEBRC6S4VBQZJS,Meish Casual Short Sleeve Embellished Women's Top,"[""Clothing >> Women's Clothing >> Western Wear >> Shirts, Tops & Tunics >> Tops >> Meish Tops""]",TOPEBRC6S4VBQZJS,799.0,639.0,"[""http://img6a.flixcart.com/image/top/b/h/s/1-1-me25blk-meish-xl-original-imaebq5eajt5rrp7.jpeg"", ""http://img6a.flixcart.com/image/top/b/h/s/1-1-me25blk-meish-l-original-imaebq5eyfeacg3b.jpeg"", ""http://img5a.flixcart.com/image/top/b/h/s/1-1-me25blk-meish-xl-original-imaebq5emu5umfpj.jpeg"", ""http://img6a.flixcart.com/image/top/b/h/s/1-1-me25blk-meish-l-original-imaebq5enhbbxakf.jpeg"", ""http://img5a.flixcart.com/image/top/b/h/s/1-1-me25blk-meish-m-original-imaebq5e4hezxnh8.jpeg""]",False,Meish Casual Short Sleeve Embellished Women's Top - Buy Black Meish Casual Short Sleeve Embellished Women's Top For Only Rs. 799 Online in India. Shop Online For Apparels. Huge Collection of Branded Clothes Only at Flipkart.com,No rating available,No rating available,unknown,"{""product_specification""=>[{""key""=>""Sleeve"", ""value""=>""Short Sleeve""}, {""key""=>""Belt Included"", ""value""=>""No""}, {""key""=>""Number of Contents in Sales Package"", ""value""=>""Pack of 1""}, {""key""=>""Fabric"", ""value""=>""100% Cotton""}, {""key""=>""Type"", ""value""=>""Top""}, {""key""=>""Neck"", ""value""=>""Round Neck""}, {""key""=>""Pattern"", ""value""=>""Embellished""}, {""key""=>""Ideal For"", ""value""=>""Women's""}, {""key""=>""Occasion"", ""value""=>""Casual""}, {""value""=>""Mild Wash, Do Not Bleach""}, {""value""=>""Sequins Designs On Front""}, {""value""=>""1 Top""}]}","clothing | women's clothing | western wear | shirts, tops & tunics | tops | meish tops",clothing,meish tops,key sleeve value short sleeve key belt included value key number contents sales package value pack key fabric value 100 cotton key type value key neck value round neck key pattern value embellished key ideal value women key occasion value casual value mild wash bleach value sequins designs value,meish casual short sleeve embellished women,unknown,meish casual short sleeve embellished women buy black meish casual short sleeve embellished women rs 799 online india shop online apparels huge collection branded clothes flipkart com,clothing women clothing western wear shirts tops tunics tops meish tops,meish casual short sleeve embellished women unknown clothing women clothing western wear shirts tops tunics tops meish tops meish casual short sleeve embellished women buy black meish casual short sleeve embellished women rs 799 online india shop online apparels huge collection branded clothes flipkart com key sleeve value short sleeve key belt included value key number contents sales package value pack key fabric value 100 cotton key type value key neck value round neck key pattern value embellished key ideal value women key occasion value casual value mild wash bleach value sequins designs value
14163f6cfd65cc7a32e81d00d6bed423,2015-12-01 10:15:43 +0000,http://www.flipkart.com/indi-bargain-women-s-a-line-dress/p/itme5m4zzswpyuqq?pid=DREE5M4ZGQHEQQU7,Indi Bargain Women's A-line Dress,"[""Clothing >> Women's Clothing >> Western Wear >> Dresses & Skirts >> Dresses >> Indi Bargain Dresses""]",DREE5M4ZGQHEQQU7,1569.0,699.0,"[""http://img6a.flixcart.com/image/dress/q/u/7/1-1-113maroon-indi-bargain-free-1000x1000-imae5n5qqftxjd42.jpeg"", ""http://img5a.flixcart.com/image/dress/q/u/7/1-1-113maroon-indi-bargain-free-original-imae5n5qqftxjd42.jpeg"", ""http://img6a.flixcart.com/image/dress/q/u/7/1-1-113maroon-indi-bargain-free-original-imae5n5qhhjpqbz7.jpeg"", ""http://img6a.flixcart.com/image/dress/q/u/7/1-1-113maroon-indi-bargain-free-original-imae5n5qbzf83z8g.jpeg"", ""http://img5a.flixcart.com/image/dress/q/u/7/1-1-113maroon-indi-bargain-free-original-imae5n5qajzjqpcp.jpeg""]",False,Indi Bargain Women's A-line Dress - Buy Maroon Indi Bargain Women's A-line Dress For Only Rs. 1569 Online in India. Shop Online For Apparels. Huge Collection of Branded Clothes Only at Flipkart.com,No rating available,No rating available,unknown,"{""product_specification""=>[{""value""=>""1 Dress""}, {""key""=>""Length"", ""value""=>""Midi/Knee Length, 45 inch""}, {""key""=>""Pattern"", ""value""=>""Printed""}, {""key""=>""Occasion"", ""value""=>""Casual, Festive, Formal, Party""}, {""key""=>""Ideal For"", ""value""=>""Women's""}, {""key""=>""Sleeve"", ""value""=>""Sleeveless""}, {""key""=>""Number of Contents in Sales Package"", ""value""=>""Pack of 1""}, {""key""=>""Belt Included"", ""value""=>""No""}, {""key""=>""Fabric"", ""value""=>""Rayon""}, {""key""=>""Type"", ""value""=>""A-line""}, {""key""=>""Neck"", ""value""=>""Round neck""}, {""value""=>""Gentle Wash With Cold Water Separately""}]}",clothing | women's clothing | western wear | dresses & skirts | dresses | indi bargain dresses,clothing,indi bargain dresses,value dress key length value midi knee length 45 inch key pattern value printed key occasion value casual festive formal party key ideal value women key sleeve value sleeveless key number contents sales package value pack key belt included value key fabric value rayon key type value line key neck value round neck value gentle wash cold water separately,indi bargain women line dress,unknown,indi bargain women line dress buy maroon indi bargain women line dress rs 1569 online india shop online apparels huge collection branded clothes flipkart com,clothing women clothing western wear dresses skirts dresses indi bargain dresses,indi bargain women line dress unknown clothing women clothing western wear dresses skirts dresses indi bargain dresses indi bargain women line dress buy maroon indi bargain women line dress rs 1569 online india shop online apparels huge collection branded clothes flipkart com value dress key length value midi knee length 45 inch key pattern value printed key occasion value casual festive formal party key ideal value women key sleeve value sleeveless key number contents sales package value pack key belt included value key fabric value rayon key type value line key neck value round neck value gentle wash cold water separately
946ec2dfec8ae7834e113c131c598d36,2015-12-12 11:46:53 +0000,http://www.flipkart.com/mark-home-cotton-bath-towel/p/itmefz4vb6zysgy4?pid=BTWEFZ4VD6THQHVH,Mark Home Cotton Bath Towel,"[""Home Furnishing >> Bath Linen >> Towels""]",BTWEFZ4VD6THQHVH,799.0,599.0,"[""http://img5a.flixcart.com/image/bath-towel/h/v/h/pbtmint4-mark-home-pbtmint4-original-imaefcqanczgzmmz.jpeg"", ""http://img6a.flixcart.com/image/bath-towel/h/v/h/pbtmint4-mark-home-pbtmint4-original-imaefcqanczgzmmz.jpeg"", ""http://img5a.flixcart.com/image/bath-towel/u/f/q/twl3060-gajri-salona-bichona-twl3060-gajri-original-imae9db5ggxrtnjg.jpeg""]",False,Buy Mark Home Cotton Bath Towel at Rs. 599 at Flipkart.com. Only Genuine Products. Free Shipping. Cash On Delivery!,No rating available,No rating available,Mark Home,"{""product_specification""=>[{""key""=>""Material"", ""value""=>""Cotton""}, {""key""=>""Brand"", ""value""=>""Mark Home""}, {""key""=>""Type"", ""value""=>""Bath Towel""}, {""key""=>""GSM"", ""value""=>""550""}, {""key""=>""Model Name"", ""value""=>""Pbtmint4""}, {""key""=>""Model ID"", ""value""=>""Pbtmint4""}, {""key""=>""Color"", ""value""=>""Yellow""}, {""key""=>""Weight"", ""value""=>""620 g""}, {""key""=>""Number of Contents in Sales Package"", ""value""=>""1""}, {""key""=>""Sales Package"", ""value""=>""1 Bath Towel""}]}",home furnishing | bath linen | towels,home furnishing,towels,key material value cotton key brand value mark home key type value bath towel key gsm value 550 key model value pbtmint4 key model id value pbtmint4 key color value yellow key weight value 620 key number contents sales package value key sales package value bath towel,mark home cotton bath towel,mark home,buy mark home cotton bath towel rs 599 flipkart com genuine products free shipping cash delivery,home furnishing bath linen towels,mark home cotton bath towel mark home home furnishing bath linen towels buy mark home cotton bath towel rs 599 flipkart com genuine products free shipping cash delivery key material value cotton key brand value mark home key type value bath towel key gsm value 550 key model value pbtmint4 key model id value pbtmint4 key color value yellow key weight value 620 key number contents sales package value key sales package value bath towel
